{
  "schemaVersion": "torch.campaign.v1",
  "id": "camp_pilot-stewardship-001",
  "mode": "stewardship",
  "projectName": "Example Wallet",
  "repoUrl": "https://github.com/example/wallet",
  "gitCommit": "da39a3ee5e6b4b0d3255bfef95601890afd80709",
  "maintainer": "npub1qqqqqqqqqqqqqqqqqqqqqqqqqqqqqqqqqqqqqqqqqqqqqqqqqqqq6r8p3c",
  "status": "open",
  "scopeSummary": "Audit every source of cryptographic randomness and verify production builds cannot silently fall back to non-cryptographic implementations.",
  "contributionCategories": ["security-analysis", "test-generation"],
  "disclosurePolicy": "private-security-advisory",
  "spendingCeilingSats": 100000,
  "milestones": ["ms_pilot-audit-001"],
  "createdAt": 1785715200
}
